ID,FoodGroup,Descrip,CommonName,MfgName,ScientificName,Energy_kcal,Protein_g,Fat_g,Carb_g,Sugar_g,Fiber_g,VitA_mcg,VitB6_mg,VitB12_mcg,VitC_mg,VitE_mg,Folate_mcg,Niacin_mg,Riboflavin_mg,Thiamin_mg,Calcium_mg,Copper_mcg,Iron_mg,Magnesium_mg,Manganese_mg,Phosphorus_mg,Selenium_mcg,Zinc_mg
23473,Beef Products,"Beef, ground, 93% lean meat / 7% fat, patty, cooked, broiled",hamburger,No name,No name,185.0,26.22,8.94,0.0,0.0,0.0,3.0,0.406,2.51,0.0,0.12,7.0,5.827000000000001,0.17600000000000002,0.043,9.0,0.094,2.78,22.0,0.014,205.0,21.5,6.41
19063,Snacks,"Snacks, tortilla chips, taco-flavor",No name,No name,No name,480.0,7.9,24.2,63.1,0.0,5.3,45.0,0.297,0.0,0.9,0.0,21.0,1.999,0.204,0.242,155.0,0.18600000000000005,2.02,88.0,0.442,239.0,6.7,1.27
20004,Cereal Grains and Pasta,"Barley, hulled",No name,No name,Hordeum vulgare L.,354.0,12.48,2.3,73.48,0.8,17.3,1.0,0.318,0.0,0.0,0.57,19.0,4.604,0.285,0.6459999999999999,33.0,0.498,3.6,133.0,1.943,264.0,37.7,2.77
7920,Sausages and Luncheon Meats,"Swisswurst, pork and beef, with swiss cheese, smoked",No name,No name,No name,307.0,12.69,27.37,1.6,0.0,0.0,100.0,0.13,1.73,0.0,0.0,3.0,2.9,0.16,0.249,74.0,0.07,0.72,13.0,0.032,178.0,7.5,2.25
19248,Sweets,"Candies, HERSHEY'S, ALMOND JOY BITES",No name,Hershey Food Corp.,No name,563.0,5.58,34.5,57.54,51.71,4.3,0.0,0.06,0.0,1.0,0.0,0.0,0.33,0.16,0.04,109.0,0.18,1.33,38.0,0.0,129.0,0.0,0.79
20097,Cereal Grains and Pasta,"Pasta, homemade, made with egg, cooked",No name,No name,No name,130.0,5.28,1.74,23.54,0.0,0.0,17.0,0.037000000000000005,0.1,0.0,0.0,60.0,1.257,0.174,0.173,10.0,0.056,1.16,14.0,0.183,52.0,0.0,0.44
9063,Fruits and Fruit Juices,"Cherries, sour, red, raw",No name,No name,Prunus cerasus,50.0,1.0,0.3,12.18,8.49,1.6,64.0,0.044,0.0,10.0,0.07,8.0,0.4,0.04,0.03,16.0,0.104,0.32,9.0,0.112,15.0,0.0,0.1
23327,Beef Products,"Beef, round, top round roast, boneless, separable lean and fat, trimmed to 0"" fat, all grades, raw",Top Round Roast,No name,No name,125.0,23.45,3.5,0.0,0.0,0.0,3.0,0.631,1.64,0.0,0.23,4.0,6.4220000000000015,0.234,0.063,13.0,0.048,2.33,12.0,0.004,219.0,22.1,3.67
19255,Sweets,"Candies, MARS SNACKFOOD US, DOVE Dark Chocolate",No name,Masterfoods USA,No name,520.0,5.19,32.45,59.4,46.27,7.6,0.0,0.0,0.0,0.0,0.0,0.0,0.0,0.0,0.0,37.0,0.0,3.18,0.0,0.0,0.0,0.0,0.0
13890,Beef Products,"Beef, round, top round, separable lean only, trimmed to 1/8"" fat, choice, cooked, pan-fried","URMIS #2368, Round Steak, London Broil, Minute Steak",No name,No name,228.0,33.93,8.33,2.03,0.0,0.0,0.0,0.5820000000000001,3.9,0.0,0.17,14.0,5.394,0.315,0.12,6.0,0.129,3.4,35.0,0.02,286.0,34.5,4.58
11128,Vegetables and Vegetable Products,"Carrots, canned, regular pack, drained solids",No name,No name,No name,25.0,0.64,0.19,5.54,2.48,1.5,558.0,0.112,0.0,2.7,0.74,9.0,0.552,0.03,0.018000000000000002,25.0,0.104,0.64,8.0,0.45,24.0,0.4,0.26
8074,Breakfast Cereals,"Cereals ready-to-eat, RALSTON TASTEEOS",Includes USDA Commodity B853,Ralston Foods,No name,357.0,10.71,5.36,75.5,3.57,10.7,1071.0,1.786,5.36,21.4,0.43,1201.0,17.857,1.518,1.339,357.0,0.429,32.14,143.0,2.7,536.0,47.0,13.39
8365,Breakfast Cereals,"Cereals ready-to-eat, QUAKER, Shredded Wheat, bagged cereal",No name,"The Quaker Oats, Co.",No name,348.0,11.24,2.01,81.01,0.81,11.8,0.0,0.256,0.0,0.0,0.0,51.0,5.24,0.105,0.226,45.0,0.0,3.33,172.0,0.0,362.0,0.0,2.54
5730,Poultry Products,"Turkey, wing, from whole bird, enhanced, meat only, roasted",No name,No name,No name,127.0,26.97,2.08,0.0,0.0,0.0,3.0,0.6970000000000001,1.7,0.0,0.06,9.0,11.75,0.208,0.038,13.0,0.062,0.55,30.0,0.011,255.0,30.2,1.49
1018,Dairy and Egg Products,"Cheese, edam",No name,No name,No name,357.0,24.99,27.8,1.43,1.43,0.0,243.0,0.076,1.54,0.0,0.24,16.0,0.08199999999999999,0.389,0.037000000000000005,731.0,0.036000000000000004,0.44,30.0,0.011,536.0,14.5,3.75
11553,Vegetables and Vegetable Products,"Tomato products, canned, sauce, with onions",No name,No name,No name,42.0,1.56,0.19,9.94,0.0,1.8,43.0,0.267,0.0,12.7,0.0,22.0,1.242,0.133,0.073,17.0,0.181,0.93,19.0,0.301,39.0,0.8,0.23
7269,Sausages and Luncheon Meats,"BUTCHER BOY MEATS, INC., Turkey Franks","hot dog, wiener, frankfurter",No name,No name,239.0,13.45,18.17,4.66,2.49,0.2,15.0,0.208,0.25,0.8,0.0,7.0,2.089,0.145,0.057,148.0,0.098,1.83,14.0,0.0,246.0,0.0,2.88
17093,"Lamb, Veal, and Game Products","Veal, composite of trimmed retail cuts, separable fat, cooked",No name,No name,No name,642.0,9.42,66.74,0.0,0.0,0.0,0.0,0.11,0.55,0.0,0.25,5.0,2.79,0.12,0.02,4.0,0.044,1.0,10.0,0.012,116.0,5.5,0.87
13066,Beef Products,"Beef, flank, steak, separable lean and fat, trimmed to 0"" fat, choice, cooked, braised",No name,No name,No name,263.0,26.98,16.44,0.0,0.0,0.0,0.0,0.35,3.3,0.0,0.69,9.0,4.42,0.18,0.14,6.0,0.119,3.33,23.0,0.018000000000000002,256.0,30.4,5.77
8239,Breakfast Cereals,"Cereals ready-to-eat, GENERAL MILLS, Berry Burst CHEERIOS, Triple Berry",No name,General Mills Inc.,No name,378.0,8.8,4.5,80.5,27.0,7.6,549.0,1.852,5.6,22.2,0.44,1246.0,18.5,1.6,1.4,370.0,0.253,16.7,89.0,2.32,222.0,18.5,13.9
3229,Baby Foods,"Babyfood, dessert, peach melba, strained",No name,No name,No name,60.0,0.2,0.0,16.5,0.0,0.0,56.0,0.006,0.0,31.4,0.0,0.0,0.343,0.036000000000000004,0.006,10.0,0.17800000000000002,0.33,2.0,0.0,5.0,0.0,0.28
11359,Vegetables and Vegetable Products,"Potatoes, french fried, crinkle or regular cut, salt added in processing, frozen, as purchased",No name,No name,No name,150.0,2.34,4.99,23.96,0.21,2.0,0.0,0.196,0.0,7.7,0.1,31.0,2.14,0.037000000000000005,0.106,13.0,0.077,0.62,21.0,0.157,81.0,0.5,0.34
16370,Legumes and Legume Products,"Lentils, mature seeds, cooked, boiled, with salt",No name,No name,No name,114.0,9.02,0.38,19.54,1.8,7.9,0.0,0.17800000000000002,0.0,1.5,0.11,181.0,1.06,0.073,0.16899999999999998,19.0,0.251,3.33,36.0,0.494,180.0,2.8,1.27
13801,Beef Products,"Beef, composite of trimmed retail cuts, separable lean and fat, trimmed to 1/8"" fat, prime, raw",No name,No name,No name,265.0,18.72,20.49,0.0,0.0,0.0,0.0,0.39,2.84,0.0,0.0,6.0,3.41,0.15,0.09,7.0,0.069,1.83,19.0,0.013,176.0,14.8,3.49
2015,Spices and Herbs,"Spices, curry powder",No name,No name,No name,325.0,14.29,14.01,55.83,2.76,53.2,1.0,0.105,0.0,0.7,25.24,56.0,3.26,0.2,0.17600000000000002,525.0,1.2,19.1,255.0,8.3,367.0,40.3,4.7
8489,Breakfast Cereals,"Cereals, MALT-O-MEAL, Maple & Brown Sugar Hot Wheat Cereal, dry",No name,MOM Brands,No name,368.0,8.82,0.47,80.52,28.0,1.8,0.0,1.74,0.0,1.0,0.03,1498.0,17.12,0.93,1.05,318.0,0.0,31.29,15.0,0.0,125.0,0.0,0.5
19118,Sweets,"Candies, NESTLE, OH HENRY! Bar",No name,"Nestle USA, Inc.",No name,462.0,7.7,23.0,65.5,46.2,1.9,0.0,0.086,0.2,0.0,2.21,44.0,2.545,0.121,0.149,69.0,0.353,0.5,51.0,0.535,140.0,3.2,1.19
13851,Beef Products,"Beef, rib, small end (ribs 10-12), separable lean and fat, trimmed to 1/8"" fat, all grades, cooked, broiled",Prime Rib,No name,No name,291.0,25.85,20.04,0.0,0.0,0.0,0.0,0.541,1.52,0.0,0.49,8.0,6.881,0.125,0.07,19.0,0.078,1.66,22.0,0.009000000000000001,201.0,28.0,4.67
42158,Fats and Oils,"Creamy dressing, made with sour cream and/or buttermilk and oil, reduced calorie, cholesterol-free",No name,No name,No name,140.0,1.0,8.0,16.0,3.28,0.0,18.0,0.02,0.1,0.0,4.92,4.0,0.04,0.06,0.01,36.0,0.0,0.26,5.0,0.0,100.0,1.6,0.18
21141,Fast Foods,"BURGER KING, Vanilla Shake",No name,Burger King Corporation,No name,168.0,3.19,8.74,19.03,11.67,0.0,0.0,0.03,0.36,0.0,0.32,0.0,0.09,0.18,0.0,104.0,0.19,0.42,12.0,0.061,97.0,3.2,0.67
18240,Baked Products,"Croissants, apple",No name,No name,No name,254.0,7.4,8.7,37.1,0.0,2.5,94.0,0.032,0.2,0.5,0.0,88.0,1.6,0.16399999999999998,0.232,30.0,0.04,1.1,13.0,0.21,58.0,19.0,1.03
19117,Sweets,"Candies, halavah, plain",No name,No name,No name,469.0,12.49,21.52,60.49,0.0,4.5,0.0,0.348,0.04,0.1,0.0,65.0,2.8560000000000003,0.08800000000000001,0.424,33.0,1.202,4.53,218.0,0.873,607.0,11.5,4.32
19195,Sweets,"Puddings, rice, dry mix, prepared with whole milk",No name,No name,No name,121.0,3.25,2.82,20.68,0.0,0.1,29.0,0.034,0.24,0.7,0.0,4.0,0.441,0.138,0.07400000000000001,103.0,0.02,0.37,13.0,0.059,85.0,1.8,0.38
5735,Poultry Products,"Turkey, retail parts, wing, meat and skin, cooked, roasted",No name,No name,No name,235.0,28.74,13.29,0.13,0.0,0.0,24.0,0.59,1.36,0.0,0.17,9.0,8.876,0.205,0.037000000000000005,14.0,0.07,1.0,24.0,0.006999999999999999,192.0,28.4,2.99
17292,"Lamb, Veal, and Game Products","Lamb, Australian, imported, fresh, leg, whole (shank and sirloin), separable lean only, trimmed to 1/8"" fat, raw",No name,No name,No name,135.0,20.46,5.23,0.0,0.0,0.0,0.0,0.406,3.01,0.0,0.0,0.0,5.56,0.32,0.155,8.0,0.196,1.64,23.0,0.013,192.0,4.6,4.25
11363,Vegetables and Vegetable Products,"Potatoes, baked, flesh, without salt",No name,No name,No name,93.0,1.96,0.1,21.55,1.7,1.5,0.0,0.301,0.0,12.8,0.04,9.0,1.395,0.021,0.105,5.0,0.215,0.35,25.0,0.161,50.0,0.3,0.29
6035,"Soups, Sauces, and Gravies","Soup, escarole, canned, ready-to-serve",No name,No name,No name,11.0,0.62,0.73,0.72,0.0,0.0,44.0,0.09,0.2,1.8,0.0,14.0,0.93,0.02,0.03,13.0,0.15,0.3,2.0,0.5,32.0,0.0,0.9
9118,Fruits and Fruit Juices,"Grapefruit, raw, white, Florida",No name,No name,Citrus paradisi,32.0,0.63,0.1,8.19,0.0,0.0,0.0,0.043,0.0,37.0,0.0,9.0,0.2,0.02,0.04,15.0,0.056,0.05,9.0,0.011,7.0,0.0,0.07
1218,Dairy and Egg Products,"Yogurt, fruit variety, nonfat, fortified with vitamin D",No name,No name,No name,95.0,4.4,0.2,19.0,19.0,0.0,2.0,0.04,0.47,0.7,0.06,9.0,0.1,0.18,0.04,152.0,0.011,0.07,15.0,0.035,119.0,6.0,0.74
13911,Beef Products,"Beef, loin, top loin, separable lean and fat, trimmed to 1/8"" fat, choice, raw","URMIS # 2219, Club Steak, Kansas City Strip, New York Strip, Boneless strip steak",No name,No name,237.0,19.32,17.1,0.0,0.0,0.0,0.0,0.4,2.79,0.0,0.0,0.0,3.95,0.14,0.09,6.0,0.071,1.61,19.0,0.013,166.0,16.6,3.2
11233,Vegetables and Vegetable Products,"Kale, raw",No name,No name,Brassica oleracea (Acephala Group),49.0,4.28,0.93,8.75,2.26,3.6,500.0,0.271,0.0,120.0,1.54,141.0,1.0,0.13,0.11,150.0,1.499,1.47,47.0,0.659,92.0,0.9,0.56
19221,Sweets,"Rennin, chocolate, dry mix, prepared with whole milk",No name,No name,No name,96.0,3.2,3.34,13.34,0.0,0.5,27.0,0.041,0.32,0.8,0.0,5.0,0.106,0.152,0.036000000000000004,124.0,0.083,0.3,20.0,0.068,97.0,2.1,0.5
10115,Pork Products,"Pork, fresh, variety meats and by-products, pancreas, raw",No name,No name,No name,199.0,18.56,13.24,0.0,0.0,0.0,0.0,0.46,16.4,15.3,0.0,3.0,3.45,0.46,0.105,11.0,0.09,2.13,17.0,0.157,234.0,40.8,2.62
19204,Sweets,"Puddings, lemon, dry mix, instant, prepared with 2% milk",No name,No name,No name,107.0,2.76,1.71,20.2,0.0,0.0,46.0,0.036000000000000004,0.3,0.8,0.0,4.0,0.07200000000000001,0.13699999999999998,0.033,101.0,0.009000000000000001,0.06,11.0,0.003,207.0,2.0,0.33
16605,Legumes and Legume Products,"MORNINGSTAR FARMS Entree Chik'n Enchilada with Rice, frozen, unprepared",No name,"Kellogg, Co.",No name,102.0,4.6,2.6,17.3,2.1,2.1,0.0,0.12,0.4,0.0,0.0,0.0,1.2,0.05,0.09,69.0,0.0,1.0,27.0,0.0,91.0,0.0,0.6
23292,Beef Products,"Beef, top loin petite roast/filet, boneless, separable lean and fat, trimmed to 1/8"" fat, select, raw","URMIS #1320, Longissimus dorsi, URMIS #1322",No name,No name,170.0,21.6,9.3,0.0,0.0,0.0,4.0,0.399,2.79,0.0,0.0,3.0,3.901,0.287,0.156,7.0,0.132,2.98,26.0,0.0,225.0,23.7,8.5
8616,Breakfast Cereals,"Cereals ready-to-eat, KELLOGG's FROSTED MINI-WHEATS Bite Size Cinnamon Streusel",No name,"Kellogg, Co.",No name,349.0,8.8,1.6,84.6,22.5,10.8,0.0,0.93,2.8,0.0,0.67,616.0,9.3,0.79,0.69,36.0,0.0,30.0,83.0,0.0,354.0,0.0,2.8
5357,Poultry Products,"Chicken, broiler, rotisserie, BBQ, back meat and skin",No name,No name,No name,251.0,20.29,18.86,0.4,0.4,0.0,24.0,0.153,0.6,0.0,0.26,7.0,5.621,0.185,0.065,33.0,0.061,0.83,19.0,0.006,217.0,35.4,1.51
22963,"Meals, Entrees, and Side Dishes","Lean Pockets, Meatballs & Mozzarella",No name,No name,No name,240.0,10.49,7.7,32.28,8.81,2.0,36.0,0.102,0.46,0.0,0.0,0.0,2.982,0.248,0.428,196.0,0.08199999999999999,2.06,23.0,0.289,180.0,10.1,0.98
11338,Vegetables and Vegetable Products,"Peppers, sweet, green, frozen, chopped, boiled, drained, without salt",No name,No name,No name,18.0,0.95,0.18,3.9,0.0,0.9,15.0,0.108,0.0,41.2,0.0,10.0,1.082,0.031,0.051,8.0,0.044,0.52,7.0,0.097,13.0,0.2,0.05
20127,Cereal Grains and Pasta,"Spaghetti, spinach, cooked",No name,No name,No name,130.0,4.58,0.63,26.15,0.0,0.0,8.0,0.096,0.0,0.0,0.0,12.0,1.53,0.103,0.097,30.0,0.205,1.04,62.0,1.504,108.0,22.1,1.08
5653,Poultry Products,"Ostrich, round, raw",No name,No name,Struthio camelus,116.0,21.99,2.4,0.0,0.0,0.0,0.0,0.517,5.01,0.0,0.2,8.0,4.761,0.29,0.198,5.0,0.139,3.54,22.0,0.018000000000000002,216.0,35.8,3.8
11365,Vegetables and Vegetable Products,"Potatoes, boiled, cooked in skin, flesh, without salt",No name,No name,No name,87.0,1.87,0.1,20.13,0.87,1.8,0.0,0.299,0.0,13.0,0.01,10.0,1.439,0.02,0.106,5.0,0.188,0.31,22.0,0.138,44.0,0.3,0.3
13358,Sausages and Luncheon Meats,"Beef, cured, smoked, chopped beef",No name,No name,No name,133.0,20.19,4.42,1.86,0.0,0.0,0.0,0.35,1.73,0.0,0.0,8.0,4.577,0.175,0.083,8.0,0.026,2.85,21.0,0.029,181.0,19.7,3.93
16426,Legumes and Legume Products,"Tofu, raw, firm, prepared with calcium sulfate",No name,No name,No name,145.0,15.78,8.72,4.27,0.0,2.3,0.0,0.092,0.0,0.2,0.0,29.0,0.381,0.102,0.158,683.0,0.378,2.66,58.0,1.181,190.0,17.4,1.57
17052,"Lamb, Veal, and Game Products","Lamb, domestic, shoulder, blade, separable lean and fat, trimmed to 1/4"" fat, choice, cooked, braised",No name,No name,No name,345.0,28.51,24.73,0.0,0.0,0.0,0.0,0.11,2.83,0.0,0.16,18.0,6.04,0.21,0.06,27.0,0.121,2.35,24.0,0.027000000000000003,185.0,33.1,6.86
2009,Spices and Herbs,"Spices, chili powder",No name,No name,No name,282.0,13.46,14.28,49.7,7.19,34.8,1483.0,2.094,0.0,0.7,38.14,28.0,11.6,0.94,0.25,330.0,1.0,17.3,149.0,1.7,300.0,20.4,4.3
23597,Beef Products,"Beef, round, eye of round, roast, separable lean only, trimmed to 1/8"" fat, all grades, raw",No name,No name,No name,124.0,22.6,3.0,0.0,0.0,0.0,0.0,0.667,1.6,0.0,0.28,13.0,6.78,0.147,0.091,20.0,0.101,1.96,25.0,0.014,219.0,28.8,4.3
20647,Cereal Grains and Pasta,Millet flour,No name,No name,No name,382.0,10.75,4.25,75.12,1.66,3.5,0.0,0.3720000000000001,0.0,0.0,0.11,42.0,6.02,0.073,0.413,14.0,0.535,3.94,119.0,1.002,285.0,32.7,2.63
19161,Sweets,"Candies, MARS SNACKFOOD US, TWIX Peanut Butter Cookie Bars",No name,Masterfoods USA,No name,536.0,9.18,32.67,54.15,36.13,3.1,20.0,0.114,0.26,0.3,3.42,15.0,2.379,0.145,0.098,75.0,0.29,1.32,61.0,0.942,173.0,12.9,1.61
19175,Sweets,"Gelatin desserts, dry mix, reduced calorie, with aspartame",No name,No name,No name,198.0,15.67,0.0,80.21,0.0,0.1,0.0,0.0,0.0,0.0,0.0,0.0,0.0,0.0,0.0,8.0,0.0,0.06,2.0,0.0,1293.0,0.0,0.0
20078,Cereal Grains and Pasta,"Wheat germ, crude",No name,No name,No name,360.0,23.15,9.72,51.8,0.0,13.2,0.0,1.3,0.0,0.0,0.0,281.0,6.813,0.499,1.882,39.0,0.7959999999999999,6.26,239.0,13.300999999999998,842.0,79.2,12.29
3044,Baby Foods,"Babyfood, dinner, macaroni and tomato and beef, strained",No name,No name,No name,61.0,2.36,1.47,9.45,2.09,1.2,44.0,0.056,0.15,0.3,2.62,12.0,0.715,0.043,0.038,17.0,0.05,0.46,12.0,0.13,39.0,8.4,0.54
21008,Fast Foods,"Fast foods, biscuit, with ham",No name,No name,No name,342.0,11.85,16.3,38.75,1.97,0.7,27.0,0.12,0.03,0.1,1.23,53.0,3.08,0.28,0.45,142.0,0.032,2.41,20.0,0.32,490.0,17.1,1.46
7264,Sausages and Luncheon Meats,"LOUIS RICH, Turkey Ham (10% water added)",No name,No name,No name,113.0,18.2,4.1,0.9,0.9,0.0,0.0,0.0,0.0,0.0,0.0,0.0,0.0,0.0,0.0,5.0,0.25,1.27,22.0,0.0,294.0,0.0,2.59
8584,Breakfast Cereals,"Cereals ready-to-eat, KELLOGG'S SPECIAL K Chocolatey Delight",No name,"Kellogg, Co.",No name,381.0,6.5,7.3,81.2,29.9,10.6,725.0,2.26,6.8,68.0,0.53,755.0,22.6,1.92,1.69,18.0,0.38,26.1,61.0,3.1710000000000003,175.0,31.6,1.4
36604,Restaurant Foods,"CRACKER BARREL, chicken tenderloin platter, fried, from kid's menu",family style,Cracker Barrel,No name,294.0,18.67,15.41,20.24,0.19,1.0,2.0,0.444,0.13,0.0,1.27,0.0,7.01,0.13699999999999998,0.093,12.0,0.069,0.58,29.0,0.266,275.0,15.2,0.67
44259,Sweets,"Puddings, all flavors except chocolate, low calorie, regular, dry mix",No name,No name,No name,351.0,1.6,0.1,86.04,2.9,0.9,0.0,0.0,0.0,0.0,0.05,0.0,0.0,0.0,0.0,49.0,0.04,0.05,17.0,0.0,12.0,0.9,0.19
15236,Finfish and Shellfish Products,"Fish, salmon, Atlantic, farmed, raw",No name,No name,Salmo salar L.,208.0,20.42,13.42,0.0,0.0,0.0,0.0,0.636,3.23,3.9,3.55,26.0,8.672,0.155,0.207,9.0,0.045,0.34,27.0,0.011,240.0,24.0,0.36
18969,Baked Products,"Cream puff, eclair, custard or cream filled, iced",No name,No name,No name,334.0,4.41,18.52,37.43,22.05,0.9,23.0,0.041,0.17,0.0,0.95,100.0,1.908,0.241,0.263,35.0,0.06,0.95,10.0,0.224,71.0,15.5,0.45
18170,Baked Products,"Cookies, fig bars",No name,No name,No name,348.0,3.7,7.3,70.9,46.36,4.6,9.0,0.075,0.09,0.3,0.65,53.0,1.874,0.217,0.158,64.0,0.147,2.9,27.0,0.343,62.0,3.3,0.39
43541,Sweets,"Ice creams, chocolate, rich",No name,No name,No name,251.0,4.72,16.98,19.78,17.35,0.9,201.0,0.033,0.18,0.5,0.46,5.0,0.182,0.16699999999999998,0.03,142.0,0.175,1.02,32.0,0.173,115.0,2.1,0.64
11546,Vegetables and Vegetable Products,"Tomato products, canned, paste, without salt added",No name,No name,No name,82.0,4.32,0.47,18.91,12.18,4.1,76.0,0.21600000000000005,0.0,21.9,4.3,12.0,3.076,0.153,0.06,36.0,0.365,2.98,42.0,0.302,83.0,5.3,0.63
11634,Vegetables and Vegetable Products,"Peppers, sweet, green, freeze-dried",No name,No name,No name,314.0,17.9,3.0,68.7,38.48,21.3,282.0,2.2230000000000003,0.0,1900.0,4.0,229.0,7.4,1.2,1.2,134.0,1.389,10.4,188.0,1.897,327.0,3.7,2.41
15218,Finfish and Shellfish Products,"Fish, sunfish, pumpkin seed, cooked, dry heat",No name,No name,No name,114.0,24.87,0.9,0.0,0.0,0.0,17.0,0.138,2.31,1.0,0.0,17.0,1.462,0.085,0.092,103.0,0.385,1.54,38.0,0.897,231.0,16.2,1.99
1266,Dairy and Egg Products,"Cheese, Swiss, nonfat or fat free",No name,No name,No name,127.0,28.4,0.0,3.4,1.33,0.0,40.0,0.08,1.68,0.0,0.07,6.0,0.09,0.36,0.02,961.0,0.027000000000000003,0.17,36.0,0.0,605.0,12.7,3.9
13399,Beef Products,"Beef, round, bottom round, roast, separable lean and fat, trimmed to 0"" fat, all grades, cooked, roasted",Cube Steak,No name,No name,187.0,27.42,7.72,0.0,0.0,0.0,0.0,0.36,1.53,0.0,0.38,9.0,4.793,0.146,0.063,7.0,0.065,2.24,18.0,0.01,171.0,28.1,4.61
23477,Beef Products,"Beef, ground, 97% lean meat / 3% fat, raw",hamburger,No name,No name,115.0,21.98,3.0,0.0,0.0,0.0,4.0,0.401,2.26,0.0,0.17,4.0,5.6629999999999985,0.151,0.041,8.0,0.08,2.44,22.0,0.01,203.0,17.7,5.21
8654,Breakfast Cereals,"Cereals ready-to-eat, POST, HONEY BUNCHES OF OATS, Just Bunches, honey roasted",No name,"Post Foods, LLC",No name,433.0,7.9,11.4,75.9,23.3,6.2,395.0,0.9,2.6,0.0,1.83,583.0,8.8,0.7,0.7,42.0,0.3,14.2,76.0,0.0,234.0,25.7,2.6
8698,Breakfast Cereals,"Cereals ready-to-eat, KELLOGG, KELLOGG'S FROOT LOOPS TREASURES, Strawberry",No name,"Kellogg, Co.",No name,380.0,5.3,3.9,87.3,40.29,8.6,0.0,1.66,5.0,50.0,0.0,0.0,16.7,1.41,1.25,13.0,0.0,15.0,27.0,0.0,58.0,0.0,5.0
16579,Legumes and Legume Products,"GARDENBURGER Original, frozen, unprepared",No name,"Kellogg, Co.",No name,159.0,7.2,4.6,22.1,0.6,5.0,0.0,0.1,0.0,0.0,0.0,12.0,1.2,0.1,0.1,65.0,0.0,1.4,18.0,0.0,118.0,0.0,0.3
13862,Beef Products,"Beef, shoulder top blade steak, boneless, separable lean and fat, trimmed to 0"" fat, select, cooked, grilled",URMIS #1144,No name,No name,194.0,27.7,9.29,0.0,0.0,0.0,7.0,0.395,5.28,0.0,0.12,7.0,4.471,0.306,0.099,14.0,0.111,3.02,24.0,0.015,224.0,31.9,9.71
18259,Baked Products,"English muffins, plain, toasted, enriched, with calcium propionate (includes sourdough)",No name,No name,No name,270.0,10.32,2.02,52.65,3.47,2.8,0.0,0.067,0.05,1.7,0.36,180.0,4.99,0.28,0.541,197.0,0.16,4.65,28.0,0.63,107.0,26.3,1.4
17135,"Lamb, Veal, and Game Products","Veal, sirloin, separable lean and fat, cooked, braised",No name,No name,No name,252.0,31.26,13.14,0.0,0.0,0.0,0.0,0.35,1.48,0.0,0.41,15.0,6.58,0.35,0.05,17.0,0.128,1.2,27.0,0.035,243.0,14.0,4.32
7913,Sausages and Luncheon Meats,"Salami, pork, beef, less sodium",No name,No name,No name,396.0,15.01,30.5,15.38,6.21,0.2,4.0,0.489,1.76,0.7,0.0,8.0,4.803,0.336,0.738,94.0,0.08800000000000001,1.55,31.0,0.057,272.0,14.6,3.08
9439,Fruits and Fruit Juices,"USDA Commodity pears, canned, juice pack, drained","Commodity codes A437, A434, A431, A433",No name,No name,51.0,0.34,0.19,12.91,8.27,2.2,0.0,0.016,0.0,0.3,0.2,1.0,0.218,0.046,0.02,9.0,0.03,0.34,7.0,0.042,9.0,0.0,0.14
23214,Beef Products,"Beef, plate steak, boneless, inside skirt, separable lean and fat, trimmed to 0"" fat, all grades, cooked, grilled",No name,No name,No name,245.0,29.36,14.2,0.0,0.0,0.0,7.0,0.483,2.91,0.0,0.1,7.0,6.337999999999999,0.348,0.083,7.0,0.108,2.44,23.0,0.108,168.0,33.3,8.06
6983,"Soups, Sauces, and Gravies","Soup, ramen noodle, chicken flavor, dry",No name,No name,No name,439.0,10.22,17.52,60.23,1.96,2.9,0.0,0.039,0.0,0.0,2.41,0.0,5.5360000000000005,0.254,0.433,22.0,0.128,4.21,25.0,0.625,115.0,24.7,0.59
4025,Fats and Oils,"Salad dressing, mayonnaise, regular",No name,No name,No name,680.0,0.96,74.85,0.57,0.57,0.0,16.0,0.008,0.12,0.0,3.28,5.0,0.0,0.019,0.01,8.0,0.019,0.21,1.0,0.006999999999999999,21.0,2.3,0.15
19024,Snacks,"Snacks, granola bars, soft, coated, milk chocolate coating, chocolate chip",No name,No name,No name,466.0,5.8,24.9,63.8,0.0,3.4,7.0,0.1,0.57,0.0,0.0,26.0,0.72,0.25,0.09,103.0,0.35,2.33,66.0,0.93,199.0,0.0,1.3
23186,Beef Products,"Beef, rib eye steak, bone-in, lip-on, separable lean and fat, trimmed to 1/8"" fat, choice, cooked, grilled",URMIS #2012,No name,No name,313.0,22.71,24.7,0.0,0.0,0.0,8.0,0.45,2.0,0.0,0.1,6.0,4.752,0.29600000000000004,0.085,22.0,0.073,2.29,22.0,0.073,156.0,23.7,5.07
15189,Finfish and Shellfish Products,"Fish, bluefish, cooked, dry heat",No name,No name,No name,159.0,25.69,5.44,0.0,0.0,0.0,138.0,0.464,6.22,0.0,0.0,2.0,7.247000000000001,0.097,0.067,9.0,0.068,0.62,42.0,0.027000000000000003,291.0,46.8,1.04
16121,Legumes and Legume Products,"Soy protein concentrate, produced by alcohol extraction",No name,No name,No name,331.0,58.13,0.46,30.91,20.0,5.5,0.0,0.134,0.0,0.0,0.0,340.0,0.716,0.142,0.316,363.0,0.976,10.78,315.0,4.19,839.0,0.8,4.4
17074,"Lamb, Veal, and Game Products","Lamb, New Zealand, imported, leg chop/steak, bone-in, separable lean only, raw",No name,No name,No name,126.0,21.1,4.64,0.0,0.0,0.0,3.0,0.13699999999999998,1.64,0.0,0.14,0.0,5.2410000000000005,0.173,0.175,11.0,0.119,1.64,24.0,0.008,198.0,3.2,3.16
1253,Dairy and Egg Products,"Cheese, pasteurized process, American, without added vitamin D",No name,No name,No name,371.0,18.13,31.79,3.7,2.26,0.0,250.0,0.054000000000000006,1.5,0.0,0.8,8.0,0.076,0.234,0.015,1045.0,0.046,0.63,26.0,0.041,641.0,20.2,2.49
17051,"Lamb, Veal, and Game Products","Lamb, domestic, shoulder, blade, separable lean and fat, trimmed to 1/4"" fat, choice, raw",No name,No name,No name,259.0,16.63,20.86,0.0,0.0,0.0,0.0,0.14,2.59,0.0,0.22,19.0,5.43,0.2,0.11,17.0,0.096,1.48,21.0,0.02,160.0,19.2,4.28
7029,Sausages and Luncheon Meats,"Ham, sliced, regular (approximately 11% fat)",No name,No name,No name,163.0,16.6,8.6,3.83,0.0,1.3,0.0,0.329,0.42,4.0,0.08,7.0,2.904,0.17800000000000002,0.626,24.0,0.08900000000000001,1.02,22.0,0.557,153.0,20.7,1.35
19708,Sweets,"Puddings, lemon, dry mix, regular, with added oil, potassium, sodium",No name,No name,No name,366.0,0.1,1.5,90.3,0.0,0.1,0.0,0.005,0.0,0.0,0.0,0.0,0.019,0.024,0.005,0.0,0.024,0.17,4.0,0.025,3.0,0.7,0.02
17195,"Lamb, Veal, and Game Products","Lamb, variety meats and by-products, kidneys, raw",No name,No name,No name,97.0,15.74,2.95,0.82,0.0,0.0,95.0,0.22,52.41,11.0,0.0,28.0,7.51,2.24,0.62,13.0,0.446,6.38,17.0,0.118,246.0,126.9,2.24
15239,Finfish and Shellfish Products,"Fish, salmon, coho, farmed, cooked, dry heat",No name,No name,No name,178.0,24.3,8.23,0.0,0.0,0.0,59.0,0.568,3.17,1.5,0.0,14.0,7.393,0.113,0.1,12.0,0.08900000000000001,0.39,34.0,0.021,332.0,14.1,0.47
6967,"Soups, Sauces, and Gravies","Soup, vegetable soup, condensed, low sodium, prepared with equal volume water",No name,No name,No name,33.0,1.1,0.45,6.06,2.15,1.1,43.0,0.084,0.0,0.4,0.72,6.0,0.77,0.046,0.055,12.0,0.121,0.33,13.0,0.125,23.0,2.0,0.2
15221,Finfish and Shellfish Products,"Fish, tuna, yellowfin, fresh, cooked, dry heat",No name,No name,No name,130.0,29.15,0.59,0.0,0.0,0.0,22.0,1.038,2.35,0.0,0.29,2.0,22.07,0.13699999999999998,0.134,4.0,0.043,0.92,42.0,0.013,333.0,108.2,0.45
4544,Fats and Oils,"Shortening, household, lard and vegetable oil",No name,No name,No name,900.0,0.0,100.0,0.0,0.0,0.0,0.0,0.0,0.0,0.0,1.0,0.0,0.0,0.0,0.0,0.0,0.0,0.0,0.0,0.0,0.0,0.0,0.0
18131,Baked Products,"Cake, white, dry mix, special dietary (includes lemon-flavored)",No name,No name,No name,397.0,3.0,8.4,79.6,0.0,0.0,0.0,0.018000000000000002,0.0,0.0,0.0,111.0,2.395,0.179,0.289,26.0,0.057,1.99,10.0,0.3,296.0,2.5,0.3
11740,Vegetables and Vegetable Products,"Broccoli, flower clusters, raw",No name,No name,No name,28.0,2.98,0.35,5.24,0.0,0.0,150.0,0.159,0.0,93.2,0.0,71.0,0.638,0.119,0.065,48.0,0.045,0.88,25.0,0.229,66.0,3.0,0.4
15217,Finfish and Shellfish Products,"Fish, sucker, white, cooked, dry heat",No name,No name,No name,119.0,21.49,2.97,0.0,0.0,0.0,59.0,0.231,2.31,0.0,0.0,17.0,1.462,0.085,0.012,90.0,0.25,1.67,38.0,0.769,269.0,16.2,0.96
8582,Breakfast Cereals,"Cereals ready-to-eat, GENERAL MILLS, DORA THE EXPLORER",No name,General Mills Inc.,No name,366.0,5.6,5.7,82.8,21.2,10.2,522.0,1.852,5.6,22.2,0.93,1246.0,18.5,1.6,1.4,370.0,0.126,30.0,30.0,0.0,74.0,8.5,13.9
11081,Vegetables and Vegetable Products,"Beets, cooked, boiled, drained",No name,No name,No name,44.0,1.68,0.18,9.96,7.96,2.0,2.0,0.067,0.0,3.6,0.04,80.0,0.331,0.04,0.027000000000000003,16.0,0.07400000000000001,0.79,23.0,0.326,38.0,0.7,0.35
14003,Beverages,"Alcoholic beverage, beer, regular, all",No name,No name,No name,43.0,0.46,0.0,3.55,0.0,0.0,0.0,0.046,0.02,0.0,0.0,6.0,0.513,0.025,0.005,4.0,0.005,0.02,6.0,0.008,14.0,0.6,0.01
